MEDPLAN ASSISTÊNCIA MEDICA LTDA. (337510);Médico Hospitalar;Médio;1;1;100,00;100,00;100,00;100,00;100,00;80,00;75,00;75,00;100,00;100,00;100,00;100,00;201612;22/01/2017 02:12:18
MED-TOUR ADMINISTRADORA DE BENEFÍCIOS E EMPREENDIMENTOS LTDA. (328537);Médico Hospitalar;Médio;163;134;95,65;96,43;94,44;100,00;100,00;100,00;100,00;100,00;94,12;88,89;85,71;93,33;201612;22/01/2017 02:12:18
MEMORIAL SAUDE LTDA (373010);Médico Hospitalar;Grande;1;1;100,00;100,00;100,00;100,00;100,00;100,00;92,86;95,00;95,00;100,00;100,00;100,00;201612;22/01/2017 02:12:18
METRUS INSTITUTO DE SEGURIDADE SOCIAL (380661);Médico Hospitalar;Médio;1;1;100,00;100,00;100,00;100,00;100,00;100,00;100,00;100,00;100,00;50,00;0,00;50,00;201612;22/01/2017 02:12:18
MH VIDA - OPERADORA DE PLANOS DE SAÚDE - EIRELI (412015);Médico Hospitalar;Pequeno;;1;;100,00;100,00;100,00;100,00;;;;;;;;201612;22/01/2017 02:12:18
MINERAÇÃO CARAÍBA S/A (416703);Médico Hospitalar;Pequeno;;;;;;;;;;;;;;;201612;22/01/2017 02:12:18
MULTI SAÚDE ASSISTÊNCIA MÉDICA E HOSPITALAR LTDA (402851);Médico Hospitalar;Pequeno;1;1;100,00;100,00;91,67;93,33;90,91;100,00;100,00;100,00;100,00;100,00;;;201612;22/01/2017 02:12:18
MULTICLINICA SERVICOS DE SAUDE LTDA (354554);Médico Hospitalar;Pequeno;;;;;;;;;;;100,00;100,00;100,00;;201612;22/01/2017 02:12:18
MÚTUA DOS MAGISTRADOS DO ESTADO DO RIO DE JANEIRO (418650);Médico Hospitalar;Pequeno;;;;;;;;;;;;;;0,00;201612;22/01/2017 02:12:18
NOSAMED ASSISTÊNCIA MÉDICA LTDA. (305928);Médico Hospitalar;Pequeno;125;132;0,00;0,00;0,00;;;;;;;;;;201612;22/01/2017 02:12:18
NOSSA SAÚDE - OPERADORA PLANOS PRIVADOS DE ASSISTÊNCIA  À SAÚDE LTDA. (372609);Médico Hospitalar;Médio;1;1;100,00;100,00;100,00;88,89;83,33;78,57;81,82;75,00;66,67;50,00;75,00;90,91;201612;22/01/2017 02:12:18
NOTRE DAME INTERMÉDICA SAÚDE S.A. (359017);Médico Hospitalar;Grande;39;31;98,28;95,99;94,83;93,52;94,37;93,83;94,63;92,12;91,68;89,22;90,63;88,62;201612;22/01/2017 02:12:18
NUCLEBRÁS EQUIPAMENTOS PESADOS S/A - NUCLEP (352888);Médico Hospitalar;Pequeno;;;;;;;;;;;;;;;201612;22/01/2017 02:12:18
OESTE SAÚDE ASSISTÊNCIA A SAÚDE SUPLEMENTAR S/S LTDA (416738);Médico Hospitalar;Pequeno;;;;;;0,00;0,00;0,00;;;;;;;201612;22/01/2017 02:12:18
OMINT SERVIÇOS DE SAÚDE LTDA. (359661);Médico Hospitalar;Grande;71;73;88,89;71,43;75,00;83,33;100,00;100,00;100,00;100,00;100,00;91,67;85,71;83,33;201612;22/01/2017 02:12:18
ÔNIX OPERADORA DE PLANOS DE SAÚDE LTDA (407534);Médico Hospitalar;Pequeno;1;1;100,00;100,00;;100,00;100,00;50,00;0,00;0,00;0,00;;100,00;50,00;201612;22/01/2017 02:12:18
OPERADORA DE PLANOS DE SAÚDE SERRA IMPERIAL LTDA. (409235);Médico Hospitalar;Pequeno;;132;;0,00;33,33;33,33;50,00;;;;;;;;201612;22/01/2017 02:12:18
OPERADORA DE PLANOS PRIVADOS DE ASSISTENCIA A SAUDE CONSAUDE S/S LTDA (350729);Médico Hospitalar;Pequeno;1;1;100,00;100,00;100,00;100,00;100,00;;;0,00;0,00;0,00;;50,00;201612;22/01/2017 02:12:18
OPERADORA UNICENTRAL DE PLANOS DE SAÚDE LTDA. (318477);Médico Hospitalar;Pequeno;1;1;100,00;100,00;100,00;100,00;100,00;100,00;66,67;50,00;66,67;100,00;100,00;100,00;201612;22/01/2017 02:12:18
OPERADORA UNIESTE DE PLANOS DE SAÚDE LTDA (354511);Médico Hospitalar;Pequeno;1;1;100,00;100,00;100,00;100,00;100,00;100,00;87,50;90,00;85,71;100,00;50,00;85,71;201612;22/01/2017 02:12:18
OPLAN SAÚDE OPERADORA DE PLANO DE SAÚDE LTDA (418226);Médico Hospitalar;Pequeno;;;;;;;;;;;;;;;201612;22/01/2017 02:12:18
ORALCLASS ASSISTENCIA MÉDICA E ODONTOLOGICA LTDA. (402478);Médico Hospitalar;Pequeno;107;112;88,89;75,00;52,94;38,46;45,45;38,46;58,82;44,44;78,57;76,47;85,71;81,82;201612;22/01/2017 02:12:18
PAME - ASSOCIAÇÃO DE ASSISTÊNCIA PLENA EM SAÚDE (342408);Médico Hospitalar;Médio;1;132;100,00;97,44;92,73;89,47;88,68;91,30;93,18;93,10;94,44;100,00;100,00;95,00;201612;22/01/2017 02:12:18
PARANA ASSISTENCIA MEDICA LTDA (315265);Médico Hospitalar;Médio;1;1;100,00;100,00;100,00;100,00;100,00;100,00;100,00;66,67;50,00;62,50;77,78;77,78;201612;22/01/2017 02:12:18
PARANÁ CLÍNICAS - PLANOS DE SAÚDE S/A (350141);Médico Hospitalar;Médio;1;175;100,00;85,71;86,67;89,47;100,00;95,00;94,74;90,48;93,33;91,67;100,00;100,00;201612;22/01/2017 02:12:18
PASA - PLANO DE ASSISTENCIA A SAUDE DO APOSENTADO DA VALE (331988);Médico Hospitalar;Médio;185;183;80,00;80,00;93,33;93,33;86,67;84,62;90,00;100,00;100,00;100,00;100,00;100,00;201612;22/01/2017 02:12:18
PETROBRAS DISTRIBUIDORA S.A. (354571);Médico Hospitalar;Pequeno;107;105;88,89;83,33;87,50;100,00;83,33;50,00;40,00;60,00;70,00;87,50;83,33;100,00;201612;22/01/2017 02:12:18
PETRÓLEO BRASILEIRO S.A.-PETROBRAS (366871);Médico Hospitalar;Grande;57;49;95,18;93,24;87,10;87,93;84,21;87,80;85,71;81,25;82,35;80,00;88,24;87,50;201612;22/01/2017 02:12:18
PLADISA PLANOS DE SAÚDE LTDA (419486);Médico Hospitalar;Pequeno;;;;;;;;;;;;;;;201612;22/01/2017 02:12:18
PLAMED PLANO DE ASSISTENCIA MEDICA LTDA (343463);Médico Hospitalar;Médio;168;146;93,75;94,12;87,50;86,67;85,71;76,92;75,00;71,43;83,33;70,00;81,25;66,67;201612;22/01/2017 02:12:18
PLAMEDH - PLANO DE ASSISTÊNCIA MÉDICO-HOSPITALAR LTDA (413551);Médico Hospitalar;Pequeno;;;;;;;;;;;;;;;201612;22/01/2017 02:12:18
PLAMER PLANO MEDICO RESENDE LTDA (324299);Médico Hospitalar;Pequeno;;;;;;;;;;;;;;;201612;22/01/2017 02:12:18
PLAMHEG PLANO DE ASSISTÊNCIA MEDICA E HOSPITALAR DO ESTADO DE GOIAS S/S LTDA (373141);Médico Hospitalar;Pequeno;;;;;;;;;100,00;100,00;100,00;100,00;100,00;100,00;201612;22/01/2017 02:12:18
PLAN MED ASSISTÊNCIA MÉDICA LTDA.-EPP (386898);Médico Hospitalar;Pequeno;;;;;;;;;;0,00;0,00;0,00;;;201612;22/01/2017 02:12:18
PLANO ASSISTENCIAL SÃO LUCAS LTDA (363391);Médico Hospitalar;Pequeno;;;;;;;;;100,00;100,00;100,00;100,00;100,00;;201612;22/01/2017 02:12:18
PLANO DE ASSISTÊNCIA MÉDICA MINEIRA LTDA (382281);Médico Hospitalar;Pequeno;;;;;;;;;;;;;;;201612;22/01/2017 02:12:18
PLANO DE SAÚDE ANA COSTA LTDA. (360244);Médico Hospitalar;Grande;1;1;100,00;100,00;100,00;100,00;100,00;100,00;100,00;93,33;90,91;87,50;100,00;100,00;201612;22/01/2017 02:12:18
PLANO DE SAUDE ASES LTDA. (411582);Médico Hospitalar;Pequeno;1;1;100,00;100,00;;100,00;100,00;100,00;100,00;;0,00;0,00;50,00;66,67;201612;22/01/2017 02:12:18
PLANO DE SAÚDE DA SANTA CASA DE BRAGANÇA PAULISTA (420166);Médico Hospitalar;Médio;;;;;;;;;;;;;;;201612;22/01/2017 02:12:18
PLANO DE SAUDE UNIFENAS (344010);Médico Hospitalar;Pequeno;;;;;;;;;;;;;;;201612;22/01/2017 02:12:18
PLANO HOSPITAL SAMARITANO LTDA (411256);Médico Hospitalar;Médio;177;163;87,50;88,89;87,50;100,00;100,00;100,00;100,00;100,00;83,33;83,33;71,43;80,00;201612;22/01/2017 02:12:18
PLANO SAÚDE SÃO FRANCISCO LTDA. (358053);Médico Hospitalar;Pequeno;;1;;100,00;100,00;100,00;;100,00;100,00;100,00;100,00;;;100,00;201612;22/01/2017 02:12:18
PLASAC PLANO DE SAÚDE LTDA (306444);Médico Hospitalar;Pequeno;1;;100,00;;;;;;;;;100,00;100,00;100,00;201612;22/01/2017 02:12:18
PLENA SAÚDE LTDA (348830);Médico Hospitalar;Médio;183;180;84,62;83,33;84,62;92,86;93,33;91,67;100,00;100,00;100,00;100,00;100,00;100,00;201612;22/01/2017 02:12:18
POLI SAUDE OPERADORA DE PLANO DE SAUDE LTDA (351270);Médico Hospitalar;Pequeno;;1;;100,00;100,00;100,00;;;;;;;;;201612;22/01/2017 02:12:18
POLICLIN SAÚDE S/A. (415693);Médico Hospitalar;Médio;1;163;100,00;88,89;88,89;90,91;100,00;100,00;100,00;100,00;100,00;100,00;100,00;100,00;201612;22/01/2017 02:12:18
POLICON ASSISTENCIA MÉDICA LTDA - EPP (412228);Médico Hospitalar;Pequeno;;;;;;100,00;100,00;100,00;100,00;100,00;100,00;;;;201612;22/01/2017 02:12:18
POLIMÉDICA SAÚDE SOCIEDADE SIMPLES LTDA (316903);Médico Hospitalar;Pequeno;;;;;;;;;;;;;;;201612;22/01/2017 02:12:18
POLYMED - POLYCLÍNICA MÉDICA E OPERADORA DE PLANOS DE SAÚDE S/S LTDA (332291);Médico Hospitalar;Pequeno;;;;;;;;;;;;;;;201612;22/01/2017 02:12:18
PORTO ALEGRE CLÍNICAS LTDA. (346870);Médico Hospitalar;Médio;1;1;100,00;100,00;100,00;100,00;100,00;100,00;100,00;100,00;100,00;100,00;;100,00;201612;22/01/2017 02:12:18
PORTO DIAS SAUDE LTDA. (415081);Médico Hospitalar;Pequeno;;;;;;;;;;;;;;;201612;22/01/2017 02:12:18
PORTO SEGURO - SEGURO SAÚDE S/A (000582);Médico Hospitalar;Grande;59;46;94,74;94,12;93,75;94,64;96,72;100,00;95,56;88,64;84,78;88,64;92,50;91,49;201612;22/01/2017 02:12:18
PORTOMED - PORTO SEGURO SERVIÇOS DE SAUDE LTDA (417491);Médico Hospitalar;Médio;1;1;100,00;100,00;100,00;87,50;75,00;0,00;100,00;87,50;87,50;87,50;100,00;90,91;201612;22/01/2017 02:12:18
POSTAL SAÚDE CAIXA DE ASSISTÊNCIA E SAÚDE DOS EMPREGADOS DOS CORREIOS (419133);Médico Hospitalar;Grande;56;53;95,42;93,04;90,86;89,09;90,45;90,91;93,88;88,36;86,57;86,82;93,08;95,24;201612;22/01/2017 02:12:18
PREMIUM SAÚDE EIRELI - ME (417823);Médico Hospitalar;Médio;1;1;100,00;100,00;100,00;100,00;75,00;75,00;60,00;66,67;50,00;100,00;;;201612;22/01/2017 02:12:18
PREV SAÚDE - ASSOCIAÇÃO DE ASSISTÊNCIA MÉDICA PRIVADA (414948);Médico Hospitalar;Pequeno;;;;;;;;;;;;;;;201612;22/01/2017 02:12:18
PREVENT SENIOR CORPORATE OPERADORA DE SAÚDE LTDA. (413267);Médico Hospitalar;Pequeno;1;1;100,00;100,00;100,00;;;;;;;;;;201612;22/01/2017 02:12:18
PREVENT SENIOR PRIVATE OPERADORA DE SAÚDE LTDA (302147);Médico Hospitalar;Grande;33;21;99,10;98,56;98,23;97,47;98,13;95,08;95,41;92,93;94,85;93,98;95,65;98,36;201612;22/01/2017 02:12:18
PRO SALUTE SERVIÇOS PARA A SAÚDE LTDA. (369373);Médico Hospitalar;Médio;;1;;100,00;100,00;66,67;50,00;50,00;;;0,00;0,00;66,67;66,67;201612;22/01/2017 02:12:18
PROASA - PROGRAMA ADVENTISTA DE  SAÚDE (310522);Médico Hospitalar;Pequeno;;;;;;;100,00;100,00;100,00;100,00;100,00;100,00;;;201612;22/01/2017 02:12:18
PROMED ASSISTENCIA MEDICA LTDA (348805);Médico Hospitalar;Médio;1;153;100,00;91,89;88,37;86,00;86,05;80,65;80,00;79,49;83,33;82,50;87,10;82,50;201612;22/01/2017 02:12:18
PROMED ASSISTÊNCIA MÉDICA LTDA (410632);Médico Hospitalar;Médio;1;154;100,00;91,67;92,86;90,91;100,00;85,71;66,67;77,78;85,71;100,00;100,00;100,00;201612;22/01/2017 02:12:18
PROMÉDICA - PROTEÇÃO MEDICA A EMPRESAS S.A. (326861);Médico Hospitalar;Médio;1;1;100,00;100,00;100,00;100,00;100,00;100,00;94,12;87,50;77,27;72,22;76,47;90,48;201612;22/01/2017 02:12:18
PRONTOCLINICA E HOSPITAIS SAO LUCAS S/A (305626);Médico Hospitalar;Pequeno;1;1;100,00;100,00;100,00;;100,00;100,00;100,00;100,00;100,00;100,00;;;201612;22/01/2017 02:12:18
PRONTOMED ASSISTÊNCIA MEDICA LTDA. - EM LIQUIDAÇÃO EXTRAJUDICIAL (403849);Médico Hospitalar;Pequeno;125;132;0,00;0,00;0,00;14,29;25,00;30,00;25,00;12,50;0,00;0,00;33,33;100,00;201612;22/01/2017 02:12:18
PRONTOMED NOVO HAMBURGO LTDA. (302490);Médico Hospitalar;Pequeno;;;;;;;;;;;;;;;201612;22/01/2017 02:12:18
PRONTOMED PLANOS DE SAÚDE LTDA (301728);Médico Hospitalar;Médio;1;1;100,00;100,00;100,00;;;;;;;;100,00;100,00;201612;22/01/2017 02:12:18
PRONTOMEDICO PLANO DE ASSISTENCIA MEDICA LTDA (362182);Médico Hospitalar;Pequeno;;;;;;;;;;;;;;;201612;22/01/2017 02:12:18
PULMONAR CLINICA DE PNEUMOLOGIA E CIRURG TORACICA LTDA. (403369);Médico Hospitalar;Pequeno;;;;;;;;;;;;;;;201612;22/01/2017 02:12:18
QUALLITY PRÓ SAÚDE ASSISTÊNCIA MÉDICA AMBULATORIAL LTDA (418170);Médico Hospitalar;Médio;167;143;94,12;94,74;100,00;100,00;93,75;94,74;90,48;95,65;87,88;87,88;82,14;87,50;201612;22/01/2017 02:12:18
RBS PARTICIPAÇÕES S/A (418862);Médico Hospitalar;Pequeno;;;;;;;;;;;;;;;201612;22/01/2017 02:12:18
REAL GRANDEZA - FUNDAÇÃO DE PREVIDÊNCIA E ASSISTÊNCIA SOCIAL (331317);Médico Hospitalar;Médio;1;135;100,00;96,30;92,31;92,86;92,31;95,65;94,74;95,00;89,47;88,24;90,00;90,00;201612;22/01/2017 02:12:18
RN METROPOLITAN LTDA (414131);Médico Hospitalar;Médio;1;1;100,00;100,00;100,00;100,00;100,00;100,00;83,33;87,50;88,89;85,71;75,00;75,00;201612;22/01/2017 02:12:18
SALUTAR SAÚDE SEGURADORA S.A. (000027);Médico Hospitalar;Médio;160;147;96,15;93,75;95,12;94,87;93,02;93,18;90,00;93,10;84,21;88,89;86,96;89,66;201612;22/01/2017 02:12:18
SAMED - SERVIÇOS DE ASSISTÊNCIA MÉDICA, ODONTOLÓGICA E HOSPITALAR S.A. (309192);Médico Hospitalar;Médio;1;138;100,00;95,24;96,30;92,31;96,43;95,00;100,00;93,33;93,75;94,44;91,67;81,82;201612;22/01/2017 02:12:18
SAMEDIL SERVIÇOS DE ATENDIMENTO MÉDICO S/A (335614);Médico Hospitalar;Pequeno;1;1;100,00;100,00;100,00;;100,00;100,00;83,33;50,00;66,67;83,33;83,33;75,00;201612;22/01/2017 02:12:18
SAMEL PLANO DE SAÚDE LTDA (367095);Médico Hospitalar;Médio;;;;;;;;0,00;0,00;0,00;;;;100,00;201612;22/01/2017 02:12:18
SAME-SERVIÇO DE ASSISTÊNCIA MÉDICA EMPRESARIAL LTDA. (415901);Médico Hospitalar;Pequeno;;;;;;;;;;;;;;;201612;22/01/2017 02:12:18
SAMIG - SERV. DE ASSISTENCIA MEDICA DA ILHA DO GOVERNADOR LTDA (340162);Médico Hospitalar;Pequeno;1;1;100,00;100,00;100,00;100,00;100,00;100,00;66,67;50,00;66,67;100,00;100,00;100,00;201612;22/01/2017 02:12:18
SAMOC S.A. - SOCIEDADE ASSISTENCIAL MÉDICA E ODONTO CIRÚRGICA (343676);Médico Hospitalar;Pequeno;113;104;81,82;84,62;87,50;50,00;50,00;66,67;100,00;100,00;100,00;85,71;75,00;60,00;201612;22/01/2017 02:12:18
SAMP ESPÍRITO SANTO ASSISTÊNCIA MÉDICA LTDA. (342033);Médico Hospitalar;Grande;1;1;100,00;100,00;100,00;100,00;96,15;91,18;86,67;90,32;90,48;93,75;88,89;90,48;201612;22/01/2017 02:12:18
SAMP MINAS ASSISTÊNCIA MÉDICA LTDA. (346471);Médico Hospitalar;Médio;1;1;100,00;100,00;100,00;100,00;100,00;100,00;100,00;100,00;100,00;100,00;100,00;66,67;201612;22/01/2017 02:12:18
SANAMED - SAÚDE SANTO ANTONIO LTDA (384585);Médico Hospitalar;Pequeno;1;1;100,00;100,00;100,00;100,00;100,00;100,00;83,33;60,00;57,14;60,00;83,33;100,00;201612;22/01/2017 02:12:18
SANTA CASA DA MISERICÓRDIA DE SÃO JOÃO DEL REI (408522);Médico Hospitalar;Pequeno;;;;;;;;;;;;;;;201612;22/01/2017 02:12:18
SANTA CASA DE MISERICORDIA DE BARRA MANSA (338214);Médico Hospitalar;Pequeno;;;;;;;;;;;;;;;201612;22/01/2017 02:12:18
SANTA CASA DE MISERICORDIA DE ITABUNA (372404);Médico Hospitalar;Pequeno;;132;;0,00;0,00;0,00;100,00;100,00;100,00;;100,00;100,00;100,00;;201612;22/01/2017 02:12:18
SANTA CASA DE MISERICÓRDIA DE JUIZ DE FORA (342807);Médico Hospitalar;Médio;;1;;100,00;100,00;100,00;50,00;50,00;50,00;50,00;50,00;50,00;100,00;100,00;201612;22/01/2017 02:12:18
SANTA CASA DE MISERICORDIA DE PONTA GROSSA (419338);Médico Hospitalar;Pequeno;;;;;;;;;;;;;;;201612;22/01/2017 02:12:18
SANTA CASA DE MISERICORDIA DE SAO JOAQUIM DA BARRA (345091);Médico Hospitalar;Médio;;;;;;;;;100,00;100,00;100,00;;;;201612;22/01/2017 02:12:18
SANTA CASA DE MISERICORDIA DE SÃO JOSÉ DO RIO PARDO - HOSPITAL SÃO VICENTE (353264);Médico Hospitalar;Pequeno;;;;;;;;;;;;;;66,67;201612;22/01/2017 02:12:18
SANTA CASA DE MISERICÓRDIA DE TUPÃ (306045);Médico Hospitalar;Pequeno;;;;;;;;;;;;;;;201612;22/01/2017 02:12:18
SANTA CASA DE MISERICÓRDIA DE VOTUPORANGA (330116);Médico Hospitalar;Pequeno;1;1;100,00;100,00;100,00;;;100,00;100,00;100,00;;;;;201612;22/01/2017 02:12:18
SANTA CASA DE MISERICÓRDIA E ASILO DOS POBRES DE BATATAIS (344915);Médico Hospitalar;Pequeno;;;;;;;;0,00;0,00;0,00;;;;;201612;22/01/2017 02:12:18
SANTA HELENA ASSISTÊNCIA MÉDICA S/A. (355097);Médico Hospitalar;Grande;42;47;98,11;93,85;92,19;87,93;89,80;92,11;92,68;95,00;90,00;93,75;90,32;88,24;201612;22/01/2017 02:12:18
SANTA LUZIA ASSISTENCIA MEDICA S.A. (358509);Médico Hospitalar;Pequeno;122;120;50,00;66,67;66,67;100,00;100,00;100,00;;;;100,00;100,00;100,00;201612;22/01/2017 02:12:18
SANTA RITA SAUDE S/A. (348180);Médico Hospitalar;Médio;1;1;100,00;100,00;100,00;100,00;100,00;100,00;100,00;100,00;100,00;100,00;100,00;100,00;201612;22/01/2017 02:12:18
SANTA RITA SISTEMA DE SAUDE LTDA (413194);Médico Hospitalar;Médio;187;189;75,00;75,00;72,73;92,86;100,00;100,00;100,00;100,00;100,00;100,00;77,78;70,00;201612;22/01/2017 02:12:18
SANTO ANDRÉ PLANOS DE ASSISTENCIA MÉDICA LTDA. (400190);Médico Hospitalar;Médio;177;179;87,50;83,87;87,50;91,30;90,48;84,21;84,21;90,48;93,10;93,75;90,91;75,86;201612;22/01/2017 02:12:18
SÃO DOMINGOS SAÚDE- ASSISTÊNCIA MÉDICA  LTDA (319180);Médico Hospitalar;Pequeno;;;;;;;0,00;0,00;0,00;;;;;;201612;22/01/2017 02:12:18
SÃO FRANCISCO ASSISTÊNCIA MÉDICA LTDA (403962);Médico Hospitalar;Pequeno;122;120;50,00;66,67;80,00;83,33;80,00;75,00;66,67;60,00;40,00;60,00;75,00;100,00;201612;22/01/2017 02:12:18
SÃO FRANCISCO SISTEMAS DE SAÚDE SOCIEDADE EMPRESÁRIA LIMITADA (302091);Médico Hospitalar;Grande;63;65;93,48;87,30;82,19;84,42;84,72;84,06;82,81;88,14;96,36;98,00;87,50;82,86;201612;22/01/2017 02:12:18
SÃO LUCAS SAÚDE S/A (344362);Médico Hospitalar;Médio;1;176;100,00;84,62;81,82;81,82;100,00;100,00;100,00;100,00;100,00;100,00;100,00;100,00;201612;22/01/2017 02:12:18
SAO PAULO TRANSPORTE S.A. (381799);Médico Hospitalar;Pequeno;;;;;;;;;;;;100,00;100,00;100,00;201612;22/01/2017 02:12:18
SAUDE - SISTEMA ASSISTENCIAL UNIFICADO DE EMPRESAS - SOCIEDADE SIMPLES (410047);Médico Hospitalar;Médio;1;167;100,00;87,50;77,78;77,78;81,82;88,89;90,00;100,00;100,00;100,00;100,00;71,43;201612;22/01/2017 02:12:18
SAÚDE BRB - CAIXA DE ASSISTÊNCIA  (414310);Médico Hospitalar;Pequeno;;;;;;100,00;100,00;100,00;;;;100,00;100,00;100,00;201612;22/01/2017 02:12:18
SAUDE CASSEB ASSISTENCIA MEDICA LTDA (418781);Médico Hospitalar;Pequeno;;;;;;;;;;;;;;;201612;22/01/2017 02:12:18
SAUDE PAS - MEDICINA E ODONTO (409243);Médico Hospitalar;Médio;;;;;;;;;;;;;100,00;100,00;201612;22/01/2017 02:12:18
SAÚDE SANTA TEREZA LTDA. (414930);Médico Hospitalar;Médio;1;1;100,00;100,00;100,00;;;;;;;;;;201612;22/01/2017 02:12:18
SAÚDE SIM LTDA (320111);Médico Hospitalar;Médio;176;178;87,69;84,00;79,31;80,95;82,86;84,09;86,67;77,42;76,67;73,08;78,26;85,19;201612;22/01/2017 02:12:18
SBC SAÚDE LTDA. (412058);Médico Hospitalar;Pequeno;;;;;0,00;0,00;0,00;;;;;0,00;0,00;0,00;201612;22/01/2017 02:12:18
SEPACO AUTOGESTÃO (416967);Médico Hospitalar;Médio;1;1;100,00;100,00;83,33;80,00;83,33;100,00;100,00;100,00;100,00;50,00;0,00;75,00;201612;22/01/2017 02:12:18
SEPACO SAÚDE LTDA (407224);Médico Hospitalar;Pequeno;;;;;;;;;;;100,00;100,00;100,00;;201612;22/01/2017 02:12:18
SERMED-SAÚDE LTDA. (303739);Médico Hospitalar;Médio;1;1;100,00;100,00;100,00;100,00;100,00;100,00;100,00;100,00;100,00;100,00;100,00;0,00;201612;22/01/2017 02:12:18
SERPRAM - SERVIÇO DE PRESTAÇÃO DE ASSISTÊNCIA MÉDICO-HOSPITALAR S.A. (306649);Médico Hospitalar;Médio;1;1;100,00;100,00;100,00;100,00;75,00;66,67;50,00;100,00;100,00;66,67;50,00;0,00;201612;22/01/2017 02:12:18
SERVIÇO FEDERAL DE PROCESSAMENTO DE DADOS (SERPRO) (345474);Médico Hospitalar;Médio;1;189;100,00;75,00;75,00;83,33;100,00;100,00;100,00;91,67;90,91;80,00;81,82;76,92;201612;22/01/2017 02:12:18
SERVMED SAÚDE LTDA (326356);Médico Hospitalar;Pequeno;;;;;0,00;0,00;0,00;;;;;;;;201612;22/01/2017 02:12:18
SIM - CAIXA DE ASSISTÊNCIA À SAÚDE (356476);Médico Hospitalar;Médio;;;;;;;0,00;0,00;0,00;0,00;;;;;201612;22/01/2017 02:12:18
SINDIFISCO NACIONAL - SINDICATO NACIONAL DOS AUDITORES-FISCAIS DA RECEITA FEDERAL DO BRASIL (361011);Médico Hospitalar;Pequeno;1;1;100,00;100,00;100,00;100,00;50,00;66,67;50,00;100,00;100,00;100,00;100,00;;201612;22/01/2017 02:12:18
SISTEMA TOTAL DE SAÚDE LTDA. (402001);Médico Hospitalar;Pequeno;1;1;100,00;100,00;100,00;100,00;100,00;100,00;100,00;100,00;100,00;;;;201612;22/01/2017 02:12:18
SISTEMAS E PLANOS DE SAÚDE LTDA. (352586);Médico Hospitalar;Médio;1;1;100,00;100,00;100,00;100,00;100,00;100,00;100,00;90,91;92,31;91,67;100,00;100,00;201612;22/01/2017 02:12:18
SMEDSJ - SERVIÇOS MÉDICOS SÃO JOSE LTDA (349755);Médico Hospitalar;Médio;190;187;66,67;77,78;70,00;88,89;84,62;93,75;89,47;92,86;81,82;80,00;75,00;100,00;201612;22/01/2017 02:12:18
SMH - SOCIEDADE MÉDICO HOSPITALAR LTDA (351644);Médico Hospitalar;Pequeno;;;;;;;;;;;;;;;201612;22/01/2017 02:12:18
SMS - ASSISTÊNCIA MÉDICA LTDA (311405);Médico Hospitalar;Pequeno;106;100;95,45;91,18;84,00;82,35;82,35;81,82;92,31;86,36;89,66;84,62;87,50;81,82;201612;22/01/2017 02:12:18
SMV SERVIÇOS MÉDICOS LTDA (349194);Médico Hospitalar;Médio;1;1;100,00;100,00;100,00;100,00;100,00;100,00;100,00;100,00;100,00;0,00;0,00;66,67;201612;22/01/2017 02:12:18
SOBAM CENTRO MÉDICO HOSPITALAR S.A. (326500);Médico Hospitalar;Grande;1;54;100,00;92,31;81,25;83,33;89,47;100,00;100,00;100,00;100,00;100,00;100,00;100,00;201612;22/01/2017 02:12:18
SOCIAL-SOCIEDADE ASSISTENCIAL E CULTURAL (315630);Médico Hospitalar;Pequeno;;1;;100,00;100,00;100,00;;;;;100,00;100,00;100,00;100,00;201612;22/01/2017 02:12:18
SOCIEDADE BENECAP DE ASSISTÊNCIA À SAÚDE (415898);Médico Hospitalar;Pequeno;;;;;;;;;;;;;;;201612;22/01/2017 02:12:18
SOCIEDADE BENEFICENTE DEZOITO DE JULHO (413721);Médico Hospitalar;Pequeno;;;;;;;;;;100,00;100,00;100,00;;;201612;22/01/2017 02:12:18
SOCIEDADE COOPERATIVA CRUZEIRO - OPERADORA DE PLANOS DE SAUDE SOCIEDADE COOPERATIVA - EM LIQUIDAÇÃO EXTRAJUDICIAL (356107);Médico Hospitalar;Pequeno;1;126;100,00;50,00;0,00;0,00;;;;;;100,00;100,00;100,00;201612;22/01/2017 02:12:18
SOCIEDADE DE ASSISTÊNCIA MÉDICA - SAMEISA (411809);Médico Hospitalar;Pequeno;;;;;;;;;;;;;;;201612;22/01/2017 02:12:18
SOCIEDADE ESPANHOLA DE BENEFICENCIA (306207);Médico Hospitalar;Pequeno;;;;;;100,00;100,00;100,00;50,00;50,00;50,00;50,00;0,00;50,00;201612;22/01/2017 02:12:18
SOCIEDADE OPERÁRIA HUMANITÁRIA (330337);Médico Hospitalar;Pequeno;;;;;;;100,00;100,00;100,00;;;;;;201612;22/01/2017 02:12:18
SOCIEDADE PORTUGUESA DE BENEFICÊNCIA (413372);Médico Hospitalar;Pequeno;;;;;;;;;;;100,00;100,00;100,00;;201612;22/01/2017 02:12:18
SOMPO SAÚDE SEGUROS S.A. (000477);Médico Hospitalar;Grande;1;1;100,00;100,00;100,00;100,00;97,22;97,44;97,56;100,00;97,37;96,15;96,00;95,00;201612;22/01/2017 02:12:18
S.P.A SAUDE- SISTEMA DE PROMOÇÃO ASSISTENCIAL (324493);Médico Hospitalar;Pequeno;1;126;100,00;50,00;33,33;0,00;0,00;100,00;100,00;100,00;;;;100,00;201612;22/01/2017 02:12:18
SUL AMERICA COMPANHIA DE SEGURO SAÚDE (006246);Médico Hospitalar;Grande;36;28;98,78;97,11;93,70;90,87;88,95;87,06;86,90;88,17;89,84;91,15;91,95;93,63;201612;22/01/2017 02:12:18
SUL AMÉRICA SERVIÇOS DE SAÚDE S.A. (416428);Médico Hospitalar;Grande;1;1;100,00;100,00;98,31;96,97;96,92;94,55;93,75;90,24;95,45;93,18;92,50;93,62;201612;22/01/2017 02:12:18
SULMED - ASSISTÊNCIA MÉDICA LTDA (338346);Médico Hospitalar;Pequeno;;;;;;;;;;100,00;100,00;100,00;;;201612;22/01/2017 02:12:18
TELOS - FUNDAÇÃO EMBRATEL DE SEGURIDADE SOCIAL (316849);Médico Hospitalar;Pequeno;1;1;100,00;100,00;100,00;100,00;75,00;66,67;50,00;100,00;100,00;100,00;100,00;50,00;201612;22/01/2017 02:12:18
TERRAMAR ADMINISTRADORA DE PLANO DE SAUDE LTDA (412759);Médico Hospitalar;Médio;158;144;96,77;94,44;92,50;86,84;89,74;81,48;90,91;86,96;92,59;92,31;89,47;95,24;201612;22/01/2017 02:12:18
TUIUIU ADMINISTRADORES DE PLANO DE SAUDE LTDA (412252);Médico Hospitalar;Pequeno;1;1;100,00;100,00;;100,00;100,00;100,00;;100,00;100,00;100,00;;;201612;22/01/2017 02:12:18
UNIAO DE CLINICAS RIO GRANDE LTDA (361852);Médico Hospitalar;Pequeno;1;1;100,00;100,00;;;;;;;;;;;201612;22/01/2017 02:12:18
UNIÃO MÉDICA PLANOS DE SAÚDE S/A (414581);Médico Hospitalar;Médio;1;138;100,00;95,24;88,89;77,78;87,50;100,00;85,71;90,00;91,67;92,86;90,00;72,73;201612;22/01/2017 02:12:18
UNIÃO SAÚDE LTDA. (314609);Médico Hospitalar;Médio;195;193;50,00;66,67;75,00;100,00;33,33;25,00;57,14;83,33;100,00;50,00;50,00;50,00;201612;22/01/2017 02:12:18
UNIHOSP SAÚDE LTDA (385255);Médico Hospitalar;Médio;187;192;75,00;71,43;72,73;83,33;90,00;100,00;57,14;40,00;37,50;50,00;50,00;83,33;201612;22/01/2017 02:12:18
UNIHOSP SERVIÇOS DE SAÚDE EIRELI (412538);Médico Hospitalar;Médio;1;1;100,00;100,00;100,00;100,00;100,00;93,75;84,62;77,78;60,00;87,50;88,89;100,00;201612;22/01/2017 02:12:18
UNILIFE SAÚDE LTDA. - EM LIQUIDAÇÃO EXTRAJUDICIAL (413402);Médico Hospitalar;Médio;198;203;47,38;50,31;51,79;55,45;75,64;85,71;87,88;88,89;87,50;85,37;75,76;83,87;201612;22/01/2017 02:12:18
UNIMED - COOPERATIVA DE SERVIÇOS DE SAÚDE DOS VALES DO TAQUARI E RIO PARDO LTDA. (306398);Médico Hospitalar;Grande;1;1;100,00;100,00;77,78;66,67;60,00;80,00;75,00;66,67;50,00;66,67;80,00;80,00;201612;22/01/2017 02:12:18
UNIMED AGRESTE MERIDIONAL - COOPERATIVA DE TRABALHO MEDICO LTDA (312649);Médico Hospitalar;Pequeno;1;1;100,00;100,00;100,00;100,00;100,00;100,00;50,00;33,33;33,33;100,00;100,00;100,00;201612;22/01/2017 02:12:18
UNIMED ALEM PARAIBA COOPERATIVA DE TRABALHO MEDICO LTDA (313955);Médico Hospitalar;Pequeno;;;;;;;;;;;;;;;201612;22/01/2017 02:12:18
UNIMED ALFENAS COOPERATIVA DE TRABALHO MEDICO (354996);Médico Hospitalar;Pequeno;1;1;100,00;100,00;66,67;66,67;84,62;91,67;100,00;100,00;100,00;100,00;75,00;66,67;201612;22/01/2017 02:12:18
UNIMED ALTA MOGIANA COOPERATIVA DE TRABALHO MÉDICO (324159);Médico Hospitalar;Pequeno;;;;;;;;;100,00;100,00;100,00;;;100,00;201612;22/01/2017 02:12:18
UNIMED ALTO DA SERRA - SOCIEDADE COOPERATIVA DE SERVIÇO MÉDICO LTDA. (343684);Médico Hospitalar;Pequeno;1;1;100,00;100,00;100,00;;100,00;100,00;100,00;;;;;;201612;22/01/2017 02:12:18
UNIMED ALTO JACUÍ/RS - COOPERATIVA DE ASSISTÊNCIA À SAÚDE LTDA (352519);Médico Hospitalar;Pequeno;;;;;;;;;;;;;;;201612;22/01/2017 02:12:18
UNIMED ALTO PARANAIBA COOPERATIVA DE TRABALHO MEDICO (341819);Médico Hospitalar;Pequeno;;;;;;;;;;;;;;;201612;22/01/2017 02:12:18
UNIMED ALTO SÃO FRANCISCO COOPERATIVA DE TRABALHO MÉDICO (348261);Médico Hospitalar;Pequeno;;1;;100,00;100,00;100,00;;;;;;;;;201612;22/01/2017 02:12:18
UNIMED ALTO URUGUAI/RS - COOPERATIVA DE ASSISTÊNCIA À SAÚDE LTDA. (306959);Médico Hospitalar;Pequeno;;;;;;;;;;;;;;;201612;22/01/2017 02:12:18
UNIMED ALTO VALE - COOPERATIVA DE TRABALHO MÉDICO (372561);Médico Hospitalar;Pequeno;;;;;;;;;100,00;100,00;100,00;;;;201612;22/01/2017 02:12:18
UNIMED AMPARO COOPERATIVA DE TRABALHO MÉDICO (345598);Médico Hospitalar;Médio;1;1;100,00;100,00;100,00;;;;;;;;;;201612;22/01/2017 02:12:18
UNIMED ANÁPOLIS COOPERATIVA DE TRABALHO MÉDICO. (312347);Médico Hospitalar;Médio;1;1;100,00;100,00;100,00;100,00;100,00;100,00;100,00;100,00;100,00;100,00;100,00;100,00;201612;22/01/2017 02:12:18
